,Időszak:,,2010. IV. név,,,,,,,,,,
Médium ID,Médium márkaneve,Üzemeltető_ID,Üzemeltető_név,Vegtulaj_1_ID,Vegtulaj_1,Vegtulaj_2_ID,Vegtulaj_2,Vegtulaj_3_ID,Vegtulaj_3,Vegtulaj_4_ID,Vegtulaj_4,Vegtulaj_5_ID,Vegtulaj_5
10003,STORY 4,92565,SANOMA DIGITAL MEDIA Közép-európai Kommunikációs Zártkörűen Működő Részvénytársaság,1170,Sanoma Budapest Kiadói Zrt.,,,,,,,,
10018,Alföld Televízió,999999,Egyéb üzemeltető,,,,,,,,,,
10020,Animal Planet ,98206,Discovery Hungary Média Szolgáltató Korlátolt Felelősségű Társaság,1042,Discovery Polska Sp. z.o.o.,,,,,,,,
10026,Duna World (Duna II Autonómia),90621,Duna Televízió Nonprofit Zártkörűen Működő Részvénytársaság,1090,Hungária Televízió Közalapítvány,,,,,,,,
10029,AXN,98205,AXN Magyaroszág Szolgáltató Korlátolt Felelősségű Társaság,1012,AXN Central Europe LLC,,,,,,,,
10040,Bajai Televízió,90206,Baja Marketing Bajai Kommunikációs és Marketing Korlátolt Felelősségű Társaság,1013,Baja Önkormányzata,,,,,,,,
10061,Bestof TV2,92000,MTM-SBS Televízió Zártkörűen Működő Részvénytársaság,1436,VT2 Media Holding B.V.,1175,SBS Broadcasting Europe B.V.,1037,Danube Broadcasting B.V.,1147,PKS Medina ( Netherlands ) B. V.,,
10107,Comedy Central,90439,COMEDY CENTRAL MAGYARORSZÁG Zártkörűen Működő Részvénytársaság,1134,MTV Networks Productions B.V.,1094,Invisions Holding BV.,1500,Viacom Global ( Netherlands ) B. V.,,,,
10123,d1 tv,90598,Domino TV Műsorszolgáltató Zártkörűen Működő Részvénytársaság,1006,Aradi Péter,1484,Szilczer Krisztina,1485,Szilczer Attila,1483,Szilczer András,1486,Szilczer Attiláné
10128,Debrecen Televízió,90518,Debrecen Városi Televízió Korlátolt Felelősségű Társaság,1425,Debrecen Önkormányzata,,,,,,,,
10130,Spektrum Home (Deko Televízió),92968,TV Paprika Műsorszolgáltató Zártkörűen Működő Részvénytársaság,1001,Chellomedia CE Holding Zrt.,1031,CHELLOMEDIA CEE HOLDCO B.V.,,,,,,
10142,Discovery Channel,98206,Discovery Hungary Média Szolgáltató Korlátolt Felelősségű Társaság,1042,Discovery Polska Sp. z.o.o.,,,,,,,,
10151,DoQ,999999,Egyéb üzemeltető,,,,,,,,,,
10155,Duna TV ,90621,Duna Televízió Nonprofit Zártkörűen Működő Részvénytársaság,1090,Hungária Televízió Közalapítvány,,,,,,,,
10170,Echo TV,90648,"Echo Hungária TV Televíziózási, Kommunikációs és Szolgáltató Zártkörű Részvénytársaság",1207,Vasvári Csaba,1417,Széles Gábor,1418,Széles Gáborné,1419,Széles Kinga,1420,Széles Anna
10185,Erzsébetvárosi Televízió (Erzsébetvárosi TV),90759,Erzsébetvárosi Média Nonprofit Korlátolt Felelősségű Társaság,1026,Budapest VII. kerület Önkormányzata,,,,,,,,
10226,Fehérvár Televízió,90828,Fehérvár Médiacentrum Korlátolt Felelősségű Társaság,1187,Székesfehérvár Önkormányzata,,,,,,,,
10235,Film Mánia (Filmmúzeum ),90866,Filmmúzeum Műsorszolgáltató Zártkörűen Működő Részvénytársaság,1001,Chellomedia CE Holding Zrt.,1031,CHELLOMEDIA CEE HOLDCO B.V.,,,,,,
10273,Hálózat,91029,Hálózatos Televíziók Zártkörűen Működő Részvénytársaság,,,,,,,,,,
10297,Hír TV,91112,HírTV Műsorszolgáltató és Hirdetésszervező Zártkörűen Működő Részvénytársaság,1202,Töröcskei István,248035,PRO-AURUM Vagyonkezelő Zrt.,,,,,,
10403,Life Network,92176,Origo Média és Kommunikációs Szolgáltató Zártkörűen Működő Részvénytársaság,245759,Magyar Telekom Távközlési Nyrt.,,,,,,,,
10412,M1,91738,Magyar Televízió Nonprofit Zártkörűen Működő Részvénytársaság,1111,Közszolgálati Közalapítvány,,,,,,,,
10414,M2,91738,Magyar Televízió Nonprofit Zártkörűen Működő Részvénytársaság,1111,Közszolgálati Közalapítvány,,,,,,,,
10416,Magyar ATV,90167,ATV Első Magyar Magántelevíziós Zártkörűen Működő Részvénytársaság,1376,HIT ÉS ERKÖLCS KULTURÁLIS ALAP,1377,HIT GYÜLEKEZETE,1378,X & A Marketing and Holding Limited,,,,
10434,Minimax,999999,Egyéb üzemeltető,,,,,,,,,,
10435,Miskolc Városi Televizió,91920,MIKOM Miskolci Kommunikációs Nonprofit Korlátolt Felelősségű Társaság,1498,Miskolc Önkormányzata,,,,,,,,
10450,MTV (MTV Hungary),97602,Viacom Global Hungary Korlátolt Felelősségű Társaság,1134,MTV Networks Productions B.V.,1094,Invisions Holding BV.,1500,Viacom Global ( Netherlands ) B. V.,,,,
10459,Muzsika TV,999999,Egyéb üzemeltető,,,,,,,,,,
10477,Nickelodeon ,97602,Viacom Global Hungary Korlátolt Felelősségű Társaság,1134,MTV Networks Productions B.V.,1094,Invisions Holding BV.,1500,Viacom Global ( Netherlands ) B. V.,,,,
10487,Nyíregyházi Városi Televizió,93039,VÁROS-KÉP Szolgáltató Nonprofit Korlátolt Felelősségű Társaság,1140,Nyíregyháza Önkormányzata,,,,,,,,
10498,Oroszlányi TV,92180,Oroszlányi Televízió Korlátolt Felelősségű Társaság,1028,Bury Pravotinszky István,1116,Lovas István,1079,Geyer Sándor,,,,
10500,Ozone Network,92176,Origo Média és Kommunikációs Szolgáltató Zártkörűen Működő Részvénytársaság,245759,Magyar Telekom Távközlési Nyrt.,,,,,,,,
10512,Pax TV,92287,Pax Televízió Műsorszolgáltató Zártkörűen Működő Részvénytársaság,1071,Ferenczy Károly,,,,,,,,
10514,Pécs TV,999999,Egyéb üzemeltető,,,,,,,,,,
10551,Győr+TV (REVITA TV GYŐR),92510,REVITA TELEVÍZIÓ GYŐR MűSORSZOLGÁLTATÓ Zártkörűen Működő Részvénytarsaság,1340,Szabó István József,1341,Galló Ádám,1343,Bognár Pál,1344,Rácz Albert,1342,Galló Zoltán Szabolcs
10556,RTL Klub,91722,Magyar RTL Televízió Zártkörűen Működő Részvénytársaság,1323,S.I.G. Kapital SA,1032,CLT UFA S. A,,,,,,
10588,Spektrum TV,92637,Spektrum-TV Közép-Európai Műsorkészítő Zártkörűen Működő Részvénytársaság,1031,CHELLOMEDIA CEE HOLDCO B.V.,,,,,,,,
10592,SPORT M,90417,Chello Central Europe Műsorszolgáltató Zártkörűen Működő Részvénytársaság,1031,Chellomedia CEE Holdco B.V.,,,,,,,,
10593,Sport1,90417,Chello Central Europe Műsorszolgáltató Zártkörűen Működő Részvénytársaság,1031,Chellomedia CEE Holdco B.V.,,,,,,,,
10594,Sport2,90417,Chello Central Europe Műsorszolgáltató Zártkörűen Működő Részvénytársaság,1031,Chellomedia CEE Holdco B.V.,,,,,,,,
10616,Szentgotthárd Városi Televízió,92754,Szentgotthárd Városi Televízió és Kábelüzemeltető Nonprofit Korlátolt Felelősségű Társaság,1504,Török Péter,1505,Habozy László,1506,Barkóczi István Gábor,1507,Dékány István,,
10653,The Fishing and Hunting Channel,999999,Egyéb üzemeltető,,,,,,,,,,
10658,TiszapART TV,91824,MATT-2004 Szolgáltató Korlátolt Felelősségű Társaság,1135,Nagy Abonyi Attila,1103,Kenyeres Gyula,1124,Maros József,,,,
10687,TV Paprika,92968,TV Paprika Műsorszolgáltató Zártkörűen Működő Részvénytársaság,1001,Chellomedia CE Holding Zrt.,1031,CHELLOMEDIA CEE HOLDCO B.V.,,,,,,
10697,TV2,92000,MTM-SBS Televízió Zártkörűen Működő Részvénytársaság,1436,VT2 Media Holding B.V.,1175,SBS Broadcasting Europe B.V.,1037,Danube Broadcasting B.V.,1147,PKS Medina ( Netherlands ) B. V.,,
10700,Viasat6,98204,Viasat Hungária Szolgáltató Zártkörűen Működő Részvénytársaság,1133,MTG Broadcasting AB,,,,,,,,
10705,Újbuda TV,91842,Média 11. Tömegkommunikációs és Szolgáltató Korlátolt Felelősségű Társaság,1027,Budapest XI. kerület Önkormányzata,,,,,,,,
10706,Újpesti Közösségi Televízió (Újpesti Közéleti Televízió),92990,Újpesti Sajtó Szolgáltató Nonprofit Korlátolt Felelősségű Társaság,1025,Budapest IV. kerület Önkormányzata,,,,,,,,
10727,Városi Televízió Szeged,999999,Egyéb üzemeltető,,,,,,,,,,
10742,Viasat3,98204,Viasat Hungária Szolgáltató Zártkörűen Működő Részvénytársaság,1133,MTG Broadcasting AB,,,,,,,,
10747,Vitál TV,90648,"Echo Hungária TV Televíziózási, Kommunikációs és Szolgáltató Zártkörű Részvénytársaság",1207,Vasvári Csaba,1417,Széles Gábor,1418,Széles Gáborné,1419,Széles Kinga,1420,Széles Anna
10748,VIVA,97602,Viacom Global Hungary Korlátolt Felelősségű Társaság,1134,MTV Networks Productions B.V.,1094,Invisions Holding BV.,1500,Viacom Global ( Netherlands ) B. V.,,,,
10948,Paramount Channel Hungary,97602,Viacom Global Hungary Korlátolt Felelősségű Társaság,1134,MTV Networks Productions B.V.,1094,Invisions Holding BV.,1500,Viacom Global ( Netherlands ) B. V.,,,,
20020,Class FM (),90057,Advenio Műsorszolgáltató Zártkörűen Működő Részvénytársaság,1051,dr. Nyerges Zsolt,,,,,,,,
20048,Trend FM (Gazdasági Rádió) (94.2),92015,MŰSOR-HANG Műsorszolgáltató Zártkörűen Működő Részvénytársaság,1503,dr. Móré Attila,246252,PHYLAXIA 1912. Holding Nyrt.,1434,Seres István,1435,Kecskés Lászlóné,,
20049,Gazdasági Rádió (100.7),92015,MŰSOR-HANG Műsorszolgáltató Zártkörűen Működő Részvénytársaság,1503,dr. Móré Attila,246252,PHYLAXIA 1912. Holding Nyrt.,1434,Seres István,1435,Kecskés Lászlóné,,
20050,Gazdasági Rádió (95.7),92015,MŰSOR-HANG Műsorszolgáltató Zártkörűen Működő Részvénytársaság,1503,dr. Móré Attila,246252,PHYLAXIA 1912. Holding Nyrt.,1434,Seres István,1435,Kecskés Lászlóné,,
20053,Gong FM (Gong Rádió) (96.5),90955,"GONG RÁDIÓ Információs, Kereskedelmi és Szolgáltató Korlátolt Felelősségű Társaság",1020,Birizdó Károly,1144,Palásti József,1097,Kalmár László,,,,
20062,Infó Rádió (88.1),91186,Inforádió Műsorszolgáltató Korlátolt Felelősségű Társaság,1324,Whitestone International Ltd.,,,,,,,,
20066,Sláger FM (Juventus Rádió) (103.9),92455,Rádió Juventus Műsorszolgáltató Zártkörűen Működő Részvénytársaság,1355,Juventus Holdings LLC.,1356,Metro Radio International LLC.,,,,,,
20080,Klubrádió (92.9),91401,Klubrádió Szolgáltató Zártkörűen Működő Részvénytársaság,1411,Dimberia Ltd.,,,,,,,,
20090,Lánchíd Rádió (Lánchíd Rádió Budapest) (100.3),91541,Lánchíd Rádió Műsorszolgáltató Korlátolt Felelősségű Társaság,1202,Töröcskei István,885715,Infocenter.hu Média Befektetési Zrt.,,,,,,
20095,Parlamenti Rádió (MR 5) (n.a),91719,Magyar Rádió Nonprofit Zártkörűen Működő Részvénytársaság,1121,Magyar Rádió Közalapítvány,,,,,,,,
20096,Kossuth Rádió (mr1-Kossuth ) (n.a),91719,Magyar Rádió Nonprofit Zártkörűen Működő Részvénytársaság,1121,Magyar Rádió Közalapítvány,,,,,,,,
20097,Petőfi Rádió (mr2-Petőfi) (n.a),91719,Magyar Rádió Nonprofit Zártkörűen Működő Részvénytársaság,1121,Magyar Rádió Közalapítvány,,,,,,,,
20098,Bartók Rádió (mr3-Bartók) (n.a),91719,Magyar Rádió Nonprofit Zártkörűen Működő Részvénytársaság,1121,Magyar Rádió Közalapítvány,,,,,,,,
20101,Sopron Rádió (Nap Rádió ) (94.1),92263,PANNON-SOPRON Regionális TV Műsorgyártó és Szolgáltató Korlátolt Felelősségű Társaság,1180,Sopron Önkormányzata,338290,NCArt Kereskedelmi és Szolgáltató Zrt.,,,,,,
20102,Neo FM (),90878,FM1 Kommunikációs és Kulturális Zártkörűen Működő Részvénytársaság,1309,Székely Gábor,1310,Horváth László,,,,,,
20121,Rádió 1 (103.9),92443,Rádió 1 Rádióműsort Készítő és Közlő Korlátolt Felelősségű Társaság,1002,ADIL Industries Corp.,1089,Howard Business Inc.,,,,,,
20128,Rádió 1 (94.6),92443,Rádió 1 Rádióműsort Készítő és Közlő Korlátolt Felelősségű Társaság,1002,ADIL Industries Corp.,1089,Howard Business Inc.,,,,,,
20196,Sztár FM (102.1),91092,Híd Rádió Műsorkészítő és Sugárzó Zártkörűen Működő Részvénytársaság,1154,Radio Bridge Media Holding Ltd.,,,,,,,,
20210,Vörösmarty Rádió (99.2),999999,Egyéb üzemeltető,,,,,,,,,,
20237,Nemzetiségi Rádió (MR4) (n.a),91719,Magyar Rádió Nonprofit Zártkörűen Működő Részvénytársaság,1121,Magyar Rádió Közalapítvány,,,,,,,,
20271,Klubrádió (88.7),91401,Klubrádió Szolgáltató Zártkörűen Működő Részvénytársaság,1411,Dimberia Ltd.,,,,,,,,
20272,Klubrádió (89.2),91401,Klubrádió Szolgáltató Zártkörűen Működő Részvénytársaság,1411,Dimberia Ltd.,,,,,,,,
20280,Gazdasági Rádió (95.6),92015,MŰSOR-HANG Műsorszolgáltató Zártkörűen Működő Részvénytársaság,1503,dr. Móré Attila,246252,PHYLAXIA 1912. Holding Nyrt.,1434,Seres István,1435,Kecskés Lászlóné,,
20281,Gazdasági Rádió (97.5),92015,MŰSOR-HANG Műsorszolgáltató Zártkörűen Működő Részvénytársaság,1503,dr. Móré Attila,246252,PHYLAXIA 1912. Holding Nyrt.,1434,Seres István,1435,Kecskés Lászlóné,,
20282,Gazdasági Rádió (98.9),92015,MŰSOR-HANG Műsorszolgáltató Zártkörűen Működő Részvénytársaság,1503,dr. Móré Attila,246252,PHYLAXIA 1912. Holding Nyrt.,1434,Seres István,1435,Kecskés Lászlóné,,
20283,Gazdasági Rádió (100.6),92015,MŰSOR-HANG Műsorszolgáltató Zártkörűen Működő Részvénytársaság,1503,dr. Móré Attila,246252,PHYLAXIA 1912. Holding Nyrt.,1434,Seres István,1435,Kecskés Lászlóné,,
30004,Glossy girls (100xszép),90180,AXEL SPRINGER-BUDAPEST KIADÓI Kft,1352,Bérczi Zsuzsanna,1347,dr. Bayer József,1353,Bayer Iván,1354,Bayer Zsuzsanna,1010,Axel Springer AG
30010,168 óra,92851,Telegráf Kiadó Korlátolt Felelősségű Társaság,1190,Szilvásy Rudolf,1384,Bölcs Dóra,1385,Bölcs István,1386,Bölcs Ádám,1387,Mester Ákos
30013,3. évezred,92513,RF-HOBBY Lapkiadó Korlátolt Felelősségű Társaság,1146,Petr Simandl,1157,RF-HOBBY s.r.o.,,,,,,
30107,Tanító,999999,Egyéb üzemeltető,,,,,,,,,,
30112,A világ ...-b.n,92090,Népszabadság Kiadó és Nyomdaipari Zártkörűen Működő Részvénytársaság,1160,Ringier AG,,,,,,,,
30154,Adó ...,93546,Heti Világgazdaság Kiadói Zártkörűen Működő Részvénytársaság,1142,Ost Holding GmbH,,,,,,,,
30199,Réka Alakreform,92564,Sanoma Budapest Kiadói Zártkörűen Működő Részvénytársaság,1171,Sanoma Magazines Internatinal B. V.,,,,,,,,
30222,Álompár,93346,"INFORM MÉDIA Lapkiadó, Információs és Kulturális Korlátolt Felelősségű Társaság",1093,Inform Media GmbH,,,,,,,,
30226,Amelie,90938,Geomédia Kiadói Zártkörűen Működő Részvénytársaság,245748,GEOHOLDING Vállalkozási Zrt.,,,,,,,,
30277,Autó bazár,91548,Lapcom Lapkiadó és Nyomdaipari Korlátolt Felelősségü Társaság,1421,A&N International Media Limited,,,,,,,,
30278,Auto Bild Magyarország,90180,AXEL SPRINGER-BUDAPEST KIADÓI Kft,1352,Bérczi Zsuzsanna,1347,dr. Bayer József,1353,Bayer Iván,1354,Bayer Zsuzsanna,1010,Axel Springer AG
30279,Autó és stílus,92564,Sanoma Budapest Kiadói Zártkörűen Működő Részvénytársaság,1171,Sanoma Magazines Internatinal B. V.,,,,,,,,
30280,Autó magazin,92564,Sanoma Budapest Kiadói Zártkörűen Működő Részvénytársaság,1171,Sanoma Magazines Internatinal B. V.,,,,,,,,
30287,Autó-motor,90181,Axel Springer- Magyarország Korlátolt Felelősségű Társaság,1352,Bérczi Zsuzsanna,1347,dr. Bayer József,1353,Bayer Iván,1354,Bayer Zsuzsanna,1010,Axel Springer AG
30311,Otthon,92564,Sanoma Budapest Kiadói Zártkörűen Működő Részvénytársaság,1171,Sanoma Magazines Internatinal B. V.,,,,,,,,
30323,Bács Irányár,999999,Egyéb üzemeltető,,,,,,,,,,
30327,Bácskai napló,90206,Baja Marketing Bajai Kommunikációs és Marketing Korlátolt Felelősségű Társaság,1013,Baja Önkormányzata,,,,,,,,
30374,A bátonyterenyei napló (Bátonyterenyei hírvivő),999999,Egyéb üzemeltető,,,,,,,,,,
30389,Békés megyei hírlap,92093,Népújság Korlátolt Felelősségű Társaság Békéscsaba,1352,Bérczi Zsuzsanna,1347,dr. Bayer József,1353,Bayer Iván,1354,Bayer Zsuzsanna,1011,Axel Springer Verlag Beteiligungsgesellschaft Gmbh
30409,Best magazin,92564,Sanoma Budapest Kiadói Zártkörűen Működő Részvénytársaság,1171,Sanoma Magazines Internatinal B. V.,,,,,,,,
30435,Blikk,92518,Ringier Kiadó Korlátolt Felelősségű Társaság,1160,Ringier AG,,,,,,,,
30437,Blikk magazin csoport,92518,Ringier Kiadó Korlátolt Felelősségű Társaság,1160,Ringier AG,,,,,,,,
30462,Bors,91092,Híd Rádió Műsorkészítő és Sugárzó Zártkörűen Működő Részvénytársaság,1154,Radio Bridge Media Holding Ltd.,,,,,,,,
30464,Borsodi apró,93346,"INFORM MÉDIA Lapkiadó, Információs és Kulturális Korlátolt Felelősségű Társaság",1093,Inform Media GmbH,,,,,,,,
30470,Bravo,92518,Ringier Kiadó Korlátolt Felelősségű Társaság,1160,Ringier AG,,,,,,,,
30471,Bravo Girl!,92518,Ringier Kiadó Korlátolt Felelősségű Társaság,1160,Ringier AG,,,,,,,,
30474,Buci Maci,92518,Ringier Kiadó Korlátolt Felelősségű Társaság,1160,Ringier AG,,,,,,,,
30477,Budai polgár,90339,"Budai Polgár Kiadó, Tájékoztató és Kulturális Közhasznú Nonprofit Korlátolt Felelősségű Társaság",1024,Budapest II. kerület Önkormányzata,,,,,,,,
30487,Budapest business journal,90043,Absolut Media Szolgáltató és Kereskedelmi Korlátolt Felelősségű Társaság,1022,Botka Tamás,1163,ROSARIUM GLOBAL Inc,,,,,,
30497,Budapesti piac ,92368,POP Print és Online Piac Korlátolt Felelősségű Társaság,1093,Inform Media GmbH,,,,,,,,
30499,Budapest szuperinfó (lapcsoport),92368,POP Print és Online Piac Korlátolt Felelősségű Társaság,1093,Inform Media GmbH,,,,,,,,
30506,Business IT plusz ...,91149,HVG ONLINE Internetes Fejlesztő Kereskedelmi Szolgáltató és Tanácsadó Zártkörűen Működő Részvénytársaság,1142,Ost Holding GmbH,,,,,,,,
30535,Dunántúli napló cégtár ,90181,Axel Springer- Magyarország Korlátolt Felelősségű Társaság,1352,Bérczi Zsuzsanna,1347,dr. Bayer József,1353,Bayer Iván,1354,Bayer Zsuzsanna,1010,Axel Springer AG
30547,Chip,999999,Egyéb üzemeltető,,,,,,,,,,
30563,CKM,91813,Marquard Média Magyarország Kiadó Korlátolt Felelősségű Társaság,1125,Marquard Media AG,,,,,,,,
30576,Cosmopolitan,91051,Hearst Sanoma Budapest Kiadói Korlátolt Felelősségű Társaság,1170,Sanoma Budapest Kiadói Zrt.,1085,Hearst Communications Inc.,,,,,,
30594,Családi lap,93140,"Word Communications Kiadói, Kereskedelmi és Szolgáltató Korlátolt Felelősségű Társaság",1205,Vajdics Enikő,1206,Varga Miklós,,,,,,
30617,Csók és könny,90180,AXEL SPRINGER-BUDAPEST KIADÓI Kft,1352,Bérczi Zsuzsanna,1347,dr. Bayer József,1353,Bayer Iván,1354,Bayer Zsuzsanna,1010,Axel Springer AG
30647,Tiszaújváros szuperinfó,96100,"Krekk-Info Reklám, Terjesztési és Szolgáltató Nonprofit Korlátolt Felelősségű Társaság",1093,Inform Media GmbH,,,,,,,,
30650,Déli apró ,91548,Lapcom Lapkiadó és Nyomdaipari Korlátolt Felelősségü Társaság,1421,A&N International Media Limited,,,,,,,,
30654,Délmagyarország,91548,Lapcom Lapkiadó és Nyomdaipari Korlátolt Felelősségü Társaság,1421,A&N International Media Limited,,,,,,,,
30657,Délpesti kishekki ,92368,POP Print és Online Piac Korlátolt Felelősségű Társaság,1093,Inform Media GmbH,,,,,,,,
30658,Délvilág,91548,Lapcom Lapkiadó és Nyomdaipari Korlátolt Felelősségü Társaság,1421,A&N International Media Limited,,,,,,,,
30680,Diéta & fitnesz,90938,Geomédia Kiadói Zártkörűen Működő Részvénytársaság,245748,GEOHOLDING Vállalkozási Zrt.,,,,,,,,
30681,Digitális fotó,999999,Egyéb üzemeltető,,,,,,,,,,
30739,Dunaújvárosi hírlap,91105,Hírlap Press Kiadói Betéti Társaság,1142,Ost Holding GmbH,,,,,,,,
30764,Egészség plusz ...,91149,HVG ONLINE Internetes Fejlesztő Kereskedelmi Szolgáltató és Tanácsadó Zártkörűen Működő Részvénytársaság,1142,Ost Holding GmbH,,,,,,,,
30806,Élet és irodalom,91208,Irodalom Lap és Könyvkiadó Kulturális Szolgáltató Korlátolt Felelőségű Társaság,1059,Élet és Irodalom Alapítvány,1060,Élet és Irodalom Baráti Társaság,,,,,,
30819,Elle Magyarország,999999,Egyéb üzemeltető,,,,,,,,,,
30820,Elle man,999999,Egyéb üzemeltető,,,,,,,,,,
30863,Érdi újság,92881,Théma Lapkiadó Kereskedelmi és Szolgáltatási Korlátolt Felelősségű Társaság,1211,Vitézy Tamás,1346,Primatum FCP Specialized Investment Fund,,,,,,
30876,Erzsébetváros,999999,Egyéb üzemeltető,,,,,,,,,,
30888,Észak-Magyarország,93346,"INFORM MÉDIA Lapkiadó, Információs és Kulturális Korlátolt Felelősségű Társaság",1093,Inform Media GmbH,,,,,,,,
30909,Europark magazin,90181,Axel Springer- Magyarország Korlátolt Felelősségű Társaság,1352,Bérczi Zsuzsanna,1347,dr. Bayer József,1353,Bayer Iván,1354,Bayer Zsuzsanna,1010,Axel Springer AG
30914,Éva (lapcsoport),91813,Marquard Média Magyarország Kiadó Korlátolt Felelősségű Társaság,1125,Marquard Media AG,,,,,,,,
30932,Extra frizura,90938,Geomédia Kiadói Zártkörűen Működő Részvénytársaság,245748,GEOHOLDING Vállalkozási Zrt.,,,,,,,,
30956,Fanny (lapcsoport),90180,AXEL SPRINGER-BUDAPEST KIADÓI Kft,1352,Bérczi Zsuzsanna,1347,dr. Bayer József,1353,Bayer Iván,1354,Bayer Zsuzsanna,1010,Axel Springer AG
30972,Fehérvár,90828,Fehérvár Médiacentrum Korlátolt Felelősségű Társaság,1187,Székesfehérvár Önkormányzata,,,,,,,,
30973,Fehérvári 7 nap,91798,Maraton Lapcsoport-Multivizió Kiadói Korlátolt Felelősségű Társaság,1142,Ost Holding GmbH,,,,,,,,
30975,Fehérvári tények,92092,Népszava Lapkiadó Korlátolt Felelősségű Társaság,1138,Népszava Szerkesztőség Dolgozóinak Szociális Kulturális és Segélyező Egyesülete,1195,TGD Intermedia SA,,,,,,
30977,Fejér megyei hírlap,91105,Hírlap Press Kiadói Betéti Társaság,1142,Ost Holding GmbH,,,,,,,,
30986,Kiskunfélegyháza város és körzete szuperinfó,91108,Hírös Modul Szuperinfó Korlátolt Felelősségű Társaság,1213,Zakar Kristóf,1212,Zakar Dávid,1214,Zakar László,,,,
31009,Figyelő (lapcsoport),92564,Sanoma Budapest Kiadói Zártkörűen Működő Részvénytársaság,1171,Sanoma Magazines Internatinal B. V.,,,,,,,,
31048,Forró drót,90181,Axel Springer- Magyarország Korlátolt Felelősségű Társaság,1352,Bérczi Zsuzsanna,1347,dr. Bayer József,1353,Bayer Iván,1354,Bayer Zsuzsanna,1010,Axel Springer AG
31052,Fotel ,92564,Sanoma Budapest Kiadói Zártkörűen Működő Részvénytársaság,1171,Sanoma Magazines Internatinal B. V.,,,,,,,,
31053,Fotel mini ,92564,Sanoma Budapest Kiadói Zártkörűen Működő Részvénytársaság,1171,Sanoma Magazines Internatinal B. V.,,,,,,,,
31074,Futár,93346,"INFORM MÉDIA Lapkiadó, Információs és Kulturális Korlátolt Felelősségű Társaság",1093,Inform Media GmbH,,,,,,,,
31107,Geo,93186,Zöld Újság Tömegkommunikációs és Kiadói Zártkörűen Működő Részvénytársaság,1352,Bérczi Zsuzsanna,1347,dr. Bayer József,1353,Bayer Iván,1354,Bayer Zsuzsanna,1427,AXEL SPRINGER VERLAG AG
31117,Glamour,90180,AXEL SPRINGER-BUDAPEST KIADÓI Kft,1352,Bérczi Zsuzsanna,1347,dr. Bayer József,1353,Bayer Iván,1354,Bayer Zsuzsanna,1010,Axel Springer AG
31136,Gördülő hírek ,91548,Lapcom Lapkiadó és Nyomdaipari Korlátolt Felelősségü Társaság,1421,A&N International Media Limited,,,,,,,,
31143,Kecskeméti grátisz,92324,Petőfi Lap- és Könyvkiadó Korlátolt Felelősségű Társaság,1352,Bérczi Zsuzsanna,1347,dr. Bayer József,1353,Bayer Iván,1354,Bayer Zsuzsanna,1011,Axel Springer Verlag Beteiligungsgesellschaft Gmbh
31195,Parkpress,999999,Egyéb üzemeltető,,,,,,,,,,
31206,Hajdú apró,93346,"INFORM MÉDIA Lapkiadó, Információs és Kulturális Korlátolt Felelősségű Társaság",1093,Inform Media GmbH,,,,,,,,
31209,Hajdú-bihari napló,93346,"INFORM MÉDIA Lapkiadó, Információs és Kulturális Korlátolt Felelősségű Társaság",1093,Inform Media GmbH,,,,,,,,
31243,Harvard business review,93186,Zöld Újság Tömegkommunikációs és Kiadói Zártkörűen Működő Részvénytársaság,1352,Bérczi Zsuzsanna,1347,dr. Bayer József,1353,Bayer Iván,1354,Bayer Zsuzsanna,1427,AXEL SPRINGER VERLAG AG
31245,Haszon (lapcsoport),91040,Haszon Lapkiadó Korlátolt Felelősségű Társaság,1181,Stipsicz Beteiligungs GmbH,,,,,,,,
31247,Haszongép bazár,91548,Lapcom Lapkiadó és Nyomdaipari Korlátolt Felelősségü Társaság,1421,A&N International Media Limited,,,,,,,,
31254,Hatvani hírlap (Hatvani hírek) ,999999,Egyéb üzemeltető,,,,,,,,,,
31260,Házak & kertek,90180,AXEL SPRINGER-BUDAPEST KIADÓI Kft,1352,Bérczi Zsuzsanna,1347,dr. Bayer József,1353,Bayer Iván,1354,Bayer Zsuzsanna,1010,Axel Springer AG
31275,HelloBaby!,999999,Egyéb üzemeltető,,,,,,,,,,
31329,Heti válasz,91084,Heti Válasz Lap- és Könyvkiadó Szolgáltató Korlátolt Felelősségű Társaság,885715,Infocenter.hu Média Befektetési Zrt.,,,,,,,,
31331,Heves megyei hírlap,90181,Axel Springer- Magyarország Korlátolt Felelősségű Társaság,1352,Bérczi Zsuzsanna,1347,dr. Bayer József,1353,Bayer Iván,1354,Bayer Zsuzsanna,1010,Axel Springer AG
31333,Hevesi apró,93346,"INFORM MÉDIA Lapkiadó, Információs és Kulturális Korlátolt Felelősségű Társaság",1093,Inform Media GmbH,,,,,,,,
31340,Hídlap,90772,EHÍR Esztergomi Hirdető Korlátolt Felelősségű Társaság,1429,Esztergom Önkormányzata,,,,,,,,
31426,Horizon,90938,Geomédia Kiadói Zártkörűen Működő Részvénytársaság,245748,GEOHOLDING Vállalkozási Zrt.,,,,,,,,
31435,Hot!,92518,Ringier Kiadó Korlátolt Felelősségű Társaság,1160,Ringier AG,,,,,,,,
31440,Hölgyválasz ,90938,Geomédia Kiadói Zártkörűen Működő Részvénytársaság,245748,GEOHOLDING Vállalkozási Zrt.,,,,,,,,
31441,Hölgyvilág,90180,AXEL SPRINGER-BUDAPEST KIADÓI Kft,1352,Bérczi Zsuzsanna,1347,dr. Bayer József,1353,Bayer Iván,1354,Bayer Zsuzsanna,1010,Axel Springer AG
31448,Human resources magazin,90938,Geomédia Kiadói Zártkörűen Működő Részvénytársaság,245748,GEOHOLDING Vállalkozási Zrt.,,,,,,,,
31468,HVG (lapcsoport),93546,Heti Világgazdaság Kiadói Zártkörűen Működő Részvénytársaság,1142,Ost Holding GmbH,,,,,,,,
