96991,Kurens Press Media Korlátolt Felelősségű Társaság,,"1015 Budapest, Hattyú utca 14.","1015 Budapest, Hattyú utca 14.","1015 Budapest, Hattyú utca 14.","9021 Győr, Újlak utca 4. A. ép.","9021 Győr, Újlak utca 4. A. ép.","9021 Győr, Újlak utca 4. A. ép.","1124 Budapest, Nagysalló utca 3. III. em. 1."
92712,Szegedi Rendezvény- és Médiaközpont Nonprofit Korlátolt Felelelősségű Társaság,"6721 Szeged, Felső-Tisza part 2.","6721 Szeged, Felső-Tisza part 2.","6721 Szeged, Felső-Tisza part 2.","6721 Szeged, Felső-Tisza part 2.","6721 Szeged, Felső-Tisza part 2.","6721 Szeged, Felső-Tisza part 2.","6721 Szeged, Felső-Tisza part 2.","6722 Szeged, Felső-Tisza part 2."
93186,ZÖLD ÚJSÁG Tömegkommunikációs és Kiadói Zártkörűen Működő Részvénytársaság,"2800 Tatabánya, Fő tér 4.","2800 Tatabánya, Mártírok út 44.","2800 Tatabánya, Mártírok út 44.","2800 Tatabánya, Mártírok út 44.","1082 Budapest, Futó utca 35-37.","1082 Budapest, Futó utca 35-37.","1082 Budapest, Futó utca 35-37.",
98179,Euronews Hungary Korlátolt Felelősségű Társaság,,,,"1051 Budapest, Széchenyi tér 7-8. B. ép. 5. em.","1051 Budapest, Széchenyi tér 7-8. B. ép. 5. em.","1051 Budapest, Széchenyi tér 7-8. B. ép. 5. em.","1051 Budapest, Széchenyi tér 7-8. B. ép. 5. em.","1051 Budapest, Széchenyi tér 7-8. B. ép. 5. em."
92807,SZUPERINFO MAGYARORSZÁG Országos Laphálózatszervező és Tanácsadó Korlátolt Felelősségű Társaság,"4031 Debrecen, Balmazújvárosi út 11.","4031 Debrecen, Balmazújvárosi út 11.",,,,,,
99855,Radio Plus Korlátolt Felelősségű Társaság,,,,,,"1051 Budapest, Vigadó utca 2.","1016 Budapest, Hegyalja út 7-13. IV. em.","1051 Budapest, Vigadó utca 2."
92443,Rádió 1 Rádióműsort Készítő és Közlő Korlátolt Felelősségű Társaság,"1016 Budapest, Mészáros","1016 Budapest, Mészáros","1016 Budapest, Mészáros","1016 Budapest, Mészáros","1012 Budapest, Márvány utca 17.","1012 Budapest, Márvány utca 17.","1012 Budapest, Márvány utca 17.","1012 Budapest, Márvány utca 17."
90779,Euro Publicity Kereskedelmi és Szolgáltató Korlátolt Felelősségű Társaság,"1022 Budapest, Bég utca 3-5.","1022 Budapest, Bég utca 3-5.","1022 Budapest, Bég utca 3-5.","1022 Budapest, Bég utca 3-5.","1022 Budapest, Bég utca 3-5.","1022 Budapest, Bég utca 3-5.","1022 Budapest, Bég utca 3-5.","1022 Budapest, Bég utca 3-5."
91186,INFORÁDIÓ Műsorszolgáltató Korlátolt Felelősségű Társaság,"1033 Budapest, Polgár utca 8-10.","1033 Budapest, Polgár utca 8-10.","1033 Budapest, Polgár utca 8-10.","1033 Budapest, Polgár utca 8-10.","1033 Budapest, Polgár utca 8-10.","1033 Budapest, Polgár utca 8-10.","1033 Budapest, Polgár utca 8-10.","1033 Budapest, Polgár utca 8-10."
91798,Maraton Lapcsoport-Multivizió Kiadói Korlátolt Felelősségű Társaság,"8200 Veszprém, Házgyári út 12.","8200 Veszprém, Házgyári út 12.","8200 Veszprém, Házgyári út 12.","8200 Veszprém, Házgyári út 12.","8200 Veszprém, Házgyári út 12.","8200 Veszprém, Házgyári út 12.","8200 Veszprém, Házgyári út 12.","8200 Veszprém, Házgyári út 12."
96100,"Krekk-Info Reklám, Terjesztési és Szolgáltató Nonprofit Korlátolt Felelősségű Társaság","4031 Debrecen, Balmazújvárosi út 11.","4031 Debrecen, Balmazújvárosi út 11.","4031 Debrecen, Balmazújvárosi út 11.","4031 Debrecen, Balmazújvárosi út 11.","4031 Debrecen, Balmazújvárosi út 11.","4031 Debrecen, Balmazújvárosi út 11.","4031 Debrecen, Balmazújvárosi út 11.","4031 Debrecen, Balmazújvárosi út 11."
92851,Telegráf Kiadó Korlátolt Felelősségű Társaság,"1023 Budapest, Bécsi út 3-5.","1023 Budapest, Bécsi út 3-5.","1023 Budapest, Bécsi út 3-5.","1023 Budapest, Bécsi út 3-5.","1023 Budapest, Bécsi út 3-5.","1023 Budapest, Bécsi út 3-5.","1037 Budapest, Bokor utca 1-3-5.","1037 Budapest, Bokor utca 1-3-5."
99582,Nouvelle Media Korlátolt Felelősségű Társaság,,,,,,"1134 Budapest, Dévai utca 26-28. 4. em.","1033 Budapest, Kórház utca 6-12.","1033 Budapest, Kórház utca 6-12."
99317,"Mobil Lap Kiadói, Kereskedelmi és Szolgáltató Korlátolt Felelősségű Társaság",,,,,"1133 Budapest, Gogol utca 26. 2. em. 1.","1133 Budapest, Gogol utca 26. 2. em. 1.","1133 Budapest, Gogol utca 26. 2. em. 1.","1133 Budapest, Gogol utca 26. 2. em. 1."
98539,Oxygen Group Kereskedelmi és Szolgáltató Korlátolt Felelősségű Társaság,"9024 Győr, Magyar u 9.","9024 Győr, Magyar u 9.","9094 Tápszentmiklós, Fő utca 38.","9094 Tápszentmiklós, Fő utca 38.","9094 Tápszentmiklós, Fő utca 38.","9023 Győr, Magyar utca 9.","9094 Tápszentmiklós, Fő utca 38.","1027 Budapest, Bem József utca 6. fszt."
99604,Karc FM Média Rádiós Médiaszolgáltatást Támogató és Reklám Korlátolt Felelősségű Társaság,,,"2030 Érd, Homoród utca 12.","2030 Érd, Homoród utca 12.","2030 Érd, Homoród utca 12.","2030 Érd, Homoród utca 12.","1097 Budapest, Könyves Kálmán körút 12-14.","1097 Budapest, Könyves Kálmán körút 12-14."
92259,PANNON PLAKÁT Reklám Korlátolt Felelősségű Társaság,"1122 Budapest, Ráth György utca 56.","1112 Budapest, Kékperje utca 6.","1112 Budapest, Kékperje utca 6.","1112 Budapest, Kékperje utca 6.","1112 Budapest, Kékperje utca 6.","1112 Budapest, Kékperje utca 6.","1112 Budapest, Kékperje utca 6.","1112 Budapest, Kékperje utca 6."
92368,POP Print és Online Piac Korlátolt Felelősségű Társaság,"4031 Debrecen, Balmazújvárosi út 11.","4031 Debrecen, Balmazújvárosi út 11.","4031 Debrecen, Balmazújvárosi út 11.","4031 Debrecen, Balmazújvárosi út 11.","4031 Debrecen, Balmazújvárosi út 11.","4031 Debrecen, Balmazújvárosi út 11.","4031 Debrecen, Balmazújvárosi út 11.","1138 Budapest, Madarász Viktor utca 47-49."
90828,Fehérvár Médiacentrum Korlátolt Felelősségű Társaság,"8000 Székesfehérvár, Jókai utca 15.","8000 Székesfehérvár, Jókai utca 15.","8000 Székesfehérvár, Szent Vendel utca 17/A.","8000 Székesfehérvár, Szent Vendel utca 17/A.","8000 Székesfehérvár, Szent Vendel utca 17/A.","8000 Székesfehérvár, Szent Vendel utca 17/A.","8000 Székesfehérvár, Szent Vendel utca 17/A.","8000 Székesfehérvár, Szent Vendel utca 17/A."
90518,Médiacentrum Debrecen Korlátolt Felelősségű Társaság,"4025 Debrecen, Petőfi tér 10. sz.","4025 Debrecen, Petőfi tér 10. sz.","4025 Debrecen, Petőfi tér 10. sz.","4025 Debrecen, Petőfi tér 10. sz.","4025 Debrecen, Petőfi tér 10. sz.","4025 Debrecen, Petőfi tér 10. sz.","4025 Debrecen, Petőfi tér 10. sz.","4025 Debrecen, Petőfi tér 10. sz."
98611,New Wave Production Informatikai Szolgáltató és Tanácsadó Korlátolt Felelősségű Társaság,,,,"1065 Budapest, Nagymező utca 54-56.","1065 Budapest, Nagymező utca 54-56.","1072 Budapest, Klauzál utca 30.","1072 Budapest, Klauzál utca 30.","1072 Budapest, Klauzál utca 30."
92324,Petőfi Lap- és Könyvkiadó Korlátolt Felelősségű Társaság,"6000 Kecskemét, Széchenyi krt 29.","6001 Kecskemét, Széchenyi krt 29.","6000 Kecskemét, Széchenyi krt 29.","6000 Kecskemét, Mindszenti körút 63.","6000 Kecskemét, Mindszenti körút 63.","6000 Kecskemét, Mindszenti körút 63.","6000 Kecskemét, Mindszenti körút 63.",
90030,A.M. HUNGARY Korlátolt Felelősségű Társaság,"1126 Budapest, Tóth Lőrinc utca 31.","1126 Budapest, Tóth Lőrinc utca 31.","1126 Budapest, Tóth Lőrinc utca 31.","1126 Budapest, Tóth Lőrinc utca 31.","1126 Budapest, Tóth Lőrinc utca 31.","1126 Budapest, Tóth Lőrinc utca 31.","1126 Budapest, Tóth Lőrinc utca 31.","1126 Budapest, Tóth Lőrinc utca 31."
95718,Bálintfy és Társai Ingatlanberuházó Zártkörűen Működő Részvénytársaság,"1121 Budapest, Kalóz utca 7.","1061 Budapest, Andrássy út 2.","1061 Budapest, Andrássy út 2.","1061 Budapest, Andrássy út 2.","1061 Budapest, Andrássy út 2.","1061 Budapest, Andrássy út 2.","1061 Budapest, Andrássy út 2.","1061 Budapest, Andrássy út 2."
92990,Újpesti Sajtó Szolgáltató Nonprofit Korlátolt Felelősségű Társaság,"1043 Budapest, Tavasz utca 4.","1043 Budapest, Tavasz utca 4.","1043 Budapest, Tavasz utca 4.","1043 Budapest, Tavasz utca 4.","1043 Budapest, Tavasz utca 4.","1043 Budapest, Tavasz utca 4.","1043 Budapest, Tavasz utca 4.","1043 Budapest, Tavasz utca 4."
92510,GYŐR+MÉDIA Zártkörűen Működő Részvénytársaság,"9023 Győr, Vasvári P utca 1.","9023 Győr, Vasvári P utca 1.","9023 Győr, Vasvári P utca 1.","9023 Győr, Kodály Zoltán utca 32/A.","9023 Győr, Kodály Zoltán utca 32/A.","9023 Győr, Kodály Zoltán utca 32/A.","9023 Győr, Kodály Zoltán utca 32/A.","9023 Győr, Vasvári P utca 1."
90866,Filmmúzeum Műsorszolgáltató Zártkörűen Működő Részvénytársaság,"1139 Budapest, Lomb u. 23-27.","1139 Budapest, Lomb u. 23-27.",,,,,,
99814,Insider Media Lapkiadó Korlátolt Felelősségű Társaság,,,,,,"1203 Budapest, Vízisport utca 23. B. ép.","1203 Budapest, Vízisport utca 23. B. ép.","1012 Budapest, Márvány utca 17. 5. em."
90878,FM1 Kommunikációs és Kulturális Zártkörűen Működő Részvénytársaság,"1036 Budapest, Lajos utca 74-76.","1025 Budapest, Csévi utca 7. b. ép.","1071 Budapest, Dózsa György út 80. 3. em. 1.","1071 Budapest, Dózsa György út 80. 3. em. 1.","1071 Budapest, Dózsa György út 80. 3. em. 1.","1143 Budapest, Besnyői utca 13. 1. em.","1143 Budapest, Besnyői utca 13. 1. em.",
92093,Népújság Korlátolt Felelősségű Társaság Békéscsaba,"5600 Békéscsaba, Kiss Ernő utca 3.","5600 Békéscsaba, Kiss Ernő utca 3.","5600 Békéscsaba, Kiss Ernő utca 3.","5600 Békéscsaba, Kiss Ernő utca 3.","5600 Békéscsaba, Kiss Ernő utca 3.","5600 Békéscsaba, Kiss Ernő utca 3.","5600 Békéscsaba, Kiss Ernő utca 3.",
96037,STRINGONIUM PRESS Kiadó és Szolgáltató Korlátolt Felelősségű Társaság,"1061 Budapest, Andrássy út 14.","1064 Budapest, Vörösmarty utca 45. fszt. üzlet.","1064 Budapest, Vörösmarty utca 45. fszt. üzlet.","1064 Budapest, Vörösmarty utca 45. fszt. üzlet.","1064 Budapest, Vörösmarty utca 45. fszt. üzlet.","1064 Budapest, Vörösmarty utca 45. fszt. üzlet.","1064 Budapest, Vörösmarty utca 45. fszt. üzlet.",
93039,VÁROS-KÉP Szolgáltató Nonprofit Korlátolt Felelősségű Társaság,"4400 Nyíregyháza, Szabadság tér 9.","4400 Nyíregyháza, Szabadság tér 9.","4400 Nyíregyháza, Szabadság tér 9.","4400 Nyíregyháza, Szabadság tér 9.","4400 Nyíregyháza, Szabadság tér 9.","4400 Nyíregyháza, Szabadság tér 9.","4400 Nyíregyháza, Szabadság tér 9.","4400 Nyíregyháza, Szabadság tér 9."
96449,Alföld Kamera Debrecen Szolgáltató Korlátolt Felelősségű Társaság,"4029 Debrecen, Csapó utca 30. IV. em.","4029 Debrecen, Csapó utca 30. IV. em.","4029 Debrecen, Csapó utca 30. IV. em.","4029 Debrecen, Csapó utca 30. IV. em.","4029 Debrecen, Csapó utca 30. IV. em.","4029 Debrecen, Csapó utca 30. IV. em.","4029 Debrecen, Csapó utca 30. IV. em.","4029 Debrecen, Csapó utca 30. IV. em."
98666,Mediaworks Magazines Kiadó Korlátolt Felelősségű Társaság,,,,,"1082 Budapest, Futó utca 35-37.","1082 Budapest, Futó utca 35-37.","1082 Budapest, Futó utca 35-37.",
97116,Absolut Media Zártkörűen Működő ,,"1075 Budapest, (Madách Trade Center)Madách Imre út 13-14. A. ép. 8. em.","1075 Budapest, (Madách Trade Center)Madách Imre út 13-14. A. ép. 8. em.","1075 Budapest, (Madách Trade Center)Madách Imre út 13-14. A. ép. 8. em.","1075 Budapest, (Madách Trade Center)Madách Imre út 13-14. A. ép. 8. em.","1075 Budapest, (Madách Trade Center)Madách Imre út 13-14. A. ép. 8. em.","1075 Budapest, (Madách Trade Center)Madách Imre út 13-14. A. ép. 8. em.","1056 Budapest, Váci utca 81. IV. em."
96270,www.Napi.hu Online Internetes és Információs Szolgáltató Korlátolt Felelősségű Társaság,"1033 Budapest, Polgár utca 8-10.","1033 Budapest, Polgár utca 8-10.","1033 Budapest, Flórián tér 1.","1033 Budapest, Flórián tér 1.","1033 Budapest, Flórián tér 1.","1033 Budapest, Flórián tér 1.","1033 Budapest, Flórián tér 1.","1033 Budapest, Flórián tér 1."
92115,Nógrádi Média Kiadói Korlátolt Felelősségű Társaság,"3100 Salgótarján, Alkotmány út 9.","3101 Salgótarján, Alkotmány út 9.","3100 Salgótarján, Alkotmány út 9.","3046 Kisbágyon, Rákóczi utca 4.","3046 Kisbágyon, Rákóczi utca 4.","3046 Kisbágyon, Rákóczi utca 4.","3046 Kisbágyon, Rákóczi utca 4.",
99819,Napiüzlet Média Kereskedelmi és Szolgáltató Korlátolt Felelősségű Társaság,,,,,"1111 Budapest, Budafoki út 3. 4. em. 1.","1111 Budapest, Budafoki út 3. 4. em. 1.","1053 Budapest, Szép utca 5. 1. em. 3.","1053 Budapest, Szép utca 5. 1. em. 3."
91753,Magyarnarancs.hu Lapkiadó Korlátolt Felelősségű Társaság,"1016 Budapest, Naphegy tér 8. 3. em. 328.","1016 Budapest, Naphegy tér 8. 3. em. 328.","1094 Budapest, Páva utca 8. 5. em.","1094 Budapest, Páva utca 8. 5. em.","1094 Budapest, Páva utca 8. 5. em.","1094 Budapest, Páva utca 8. 5. em.","1094 Budapest, Páva utca 8. 5. em.","1094 Budapest, Páva utca 8. 5. em."
90598,Domino Tv Műsorszolgáltató Zártkörűen működő Részvénytársaság,"1065 Budapest, Nagymező u 3.","1065 Budapest, Nagymező u 3.","1065 Budapest, Nagymező u 3.","1065 Budapest, Nagymező u 3.","1065 Budapest, Nagymező u 3.","1065 Budapest, Nagymező u 3.","1065 Budapest, Nagymező u 3.","1115 Budapest, Keveháza utca 1-3."
90621,Duna Médiaszolgáltató Nonprofit Zártkörűen Működő Részvénytársaság,"1016 Budapest, Mészáros u 48.","1016 Budapest, Naphegy tér 8. 2. em.","1016 Budapest, Naphegy tér 8. 2. em.","1016 Budapest, Naphegy tér 8. 2. em.","1016 Budapest, Naphegy tér 8. 2. em.","1016 Budapest, Naphegy tér 8. 2. em.","1016 Budapest, Naphegy tér 8. 2. em.","1016 Budapest, Naphegy tér 8. 2. em."
91920,MIKOM Miskolci Kommunikációs Nonprofit Korlátolt Felelősségű Társaság,"3525 Miskolc, Kis-Hunyad u 9.","3525 Miskolc, Kis-Hunyad u 9.","3525 Miskolc, Kis-Hunyad u 9.","3525 Miskolc, Kis-Hunyad u 9.","3525 Miskolc, Kis-Hunyad u 9.","3525 Miskolc, Kis-Hunyad u 9.","3525 Miskolc, Kis-Hunyad u 9.","3525 Miskolc, Kis-Hunyad u 9."
94768,Média-Hatvan Nonprofit Közhasznú Korlátolt Felelősségű Társaság,"3000 Hatvan, Madách u. 12.","3000 Hatvan, Madách u. 12.","3000 Hatvan, Madách u. 12.","3000 Hatvan, Madách u. 12.","3000 Hatvan, Madách u. 12.","3000 Hatvan, Madách u. 12.","3000 Hatvan, Madách u. 12.","3000 Hatvan, Kossuth tér 2."
92645,SPRINT Kereskedelmi és Szolgáltató Korlátolt Felel ősségű Társaság,"1137 Budapest, Újpesti Rakpart 7.","1137 Budapest, Újpesti rakpart 7.","1137 Budapest, Újpesti rakpart 7.","1137 Budapest, Újpesti rakpart 7.","1137 Budapest, Újpesti rakpart 7.","1137 Budapest, Újpesti rakpart 7.","1137 Budapest, Újpesti rakpart 7.","1137 Budapest, Újpesti Rakpart 7."
91177,IMPRESS-RÉGIÓ Kiadó és Szolgáltató Korlátolt Felelősségű Társaság,"1052 Budapest, Váci utca 18. IV. em. 2-3.","1052 Budapest, Váci utca 18. IV. em. 2-3.","1052 Budapest, Váci utca 18. IV. em. 2-3.","1052 Budapest, Váci utca 18. IV. em. 2-3.","1052 Budapest, Váci utca 18. IV. em. 2-3.","1052 Budapest, Váci utca 18. IV. em. 2-3.","1052 Budapest, Váci utca 18. II. em. 3.","1052 Budapest, Váci utca 18. II. em. 3."
90759,Erzsébetvárosi Média Nonprofit Korlátolt Felelősségű Társaság,"1077 Budapest, Wesselényi utca 17.","1077 Budapest, Wesselényi utca 17.","1077 Budapest, Wesselényi utca 17.","1077 Budapest, Wesselényi utca 17.","1077 Budapest, Wesselényi utca 17.","1077 Budapest, Wesselényi utca 17.","1077 Budapest, Wesselényi utca 17.","1077 Budapest, Wesselényi utca 17."
92292,Pécsi Kommunikációs Központ Korlátolt Felelősségű Társaság,"7621 Pécs, Rákóczi út 11.","7622 Pécs, Rákóczi út 11.","7621 Pécs, Rákóczi út 11.","7621 Pécs, Király utca 27.","7621 Pécs, Király utca 27.","7621 Pécs, Király utca 27.","7621 Pécs, Király utca 27.","7621 Pécs, Rákóczi út 11."
98812,Színesászmédia Kereskedelmi és Szolgáltató Korlátolt Felelősségű Társaság,,,,,"1065 Budapest, Bajcsy Zsilinszky út 19. b. ép. 2. em. 3.","1065 Budapest, Bajcsy Zsilinszky út 19. b. ép. 2. em. 3.","1146 Budapest, Hungária körút 140-144.","1146 Budapest, Hungária körút 140-144."
90339,"Budai Polgár Kiadó, Tájékoztató és Kulturális Közhasznú Nonprofit Korlátolt Felelősségű Társaság","1022 Budapest, Bimbó út 1-5.","1022 Budapest, Bimbó út 1-5.","1022 Budapest, Bimbó út 1-5.","1022 Budapest, Bimbó út 1-5. A. lház. fszt.","1022 Budapest, Bimbó út 1-5. A. lház. fszt.","1022 Budapest, Bimbó út 1-5. A. lház. fszt.","1022 Budapest, Bimbó út 1-5. A. lház. fszt.","1022 Budapest, Bimbó út 1-5. A. lház. fszt."
90772,EHÍR Esztergomi Hirdető Korlátolt Felelősségű Társaság,"2500 Esztergom, Deák Ferenc utca 4.","2500 Esztergom, Deák Ferenc utca 4.","2500 Esztergom, Deák Ferenc utca 4.","2500 Esztergom, Deák Ferenc utca 4.","2500 Esztergom, Deák Ferenc utca 4.","2500 Esztergom, Deák Ferenc utca 4.","2500 Esztergom, Deák Ferenc utca 4.","2500 Esztergom, Deák Ferenc utca 4."
92180,Oroszlányi Televízió Korlátolt Felelősségű Társaság,"2840 Oroszlány, Rákóczi Ferenc u. 78.","2840 Oroszlány, Rákóczi Ferenc u. 78.","2840 Oroszlány, Rákóczi Ferenc u. 78.","2840 Oroszlány, Rákóczi Ferenc u. 78.","2840 Oroszlány, Rákóczi Ferenc u. 78.","2840 Oroszlány, Rákóczi Ferenc u. 78.","2840 Oroszlány, Rákóczi Ferenc u. 78.","2840 Oroszlány, Rákóczi Ferenc u. 78."
96941,Zselici Forrás Szolgáltató Korlátolt Felelősségű Társaság,"7400 Kaposvár, Streith Miklós utca 6.","7400 Kaposvár, Streith Miklós utca 6.","7400 Kaposvár, Streith Miklós utca 6.","7400 Kaposvár, Teleki utca 11. 1. em. 3.","7400 Kaposvár, Teleki utca 11. 1. em. 3.","7400 Kaposvár, Teleki utca 11. 1. em. 3.","7400 Kaposvár, Teleki utca 11. 1. em. 3.","7400 Kaposvár, Teleki utca 11. 1. em. 3."
97854,Helikon Infó Informatikai és Szolgáltató Korlátolt Felelősségű Társaság,"8315 Gyenesdiás, Kisfaludy utca 4.","8315 Gyenesdiás, Kisfaludy utca 4.","8315 Gyenesdiás, Kisfaludy utca 4.","8315 Gyenesdiás, Kisfaludy utca 4.","8315 Gyenesdiás, Kisfaludy utca 4.","8315 Gyenesdiás, Kisfaludy utca 4.","8315 Gyenesdiás, Kisfaludy utca 4.","8315 Gyenesdiás, Kisfaludy utca 4."
91208,IRODALOM Lap és Könyvkiadó Kulturális Szolgáltató Korlátolt Felelőségű Társaság,"1089 Budapest, Rezső tér u. 15. sz.","1089 Budapest, Rezső tér u. 15. sz.","1089 Budapest, Rezső tér u. 15. sz.","1089 Budapest, Rezső tér u. 15. sz.","1089 Budapest, Rezső tér u. 15. sz.","1089 Budapest, Rezső tér u. 15. sz.","1089 Budapest, Rezső tér u. 15. sz.","1089 Budapest, Rezső tér u. 15. sz."
98384,Epicenter Market Hungary Kereskedelmi és Szolgáltató Korlátolt Felelősségű Társaság,,,,"1023 Budapest, Margit utca 25.","1023 Budapest, Margit utca 25.","1054 Budapest, Honvéd utca 8. 1. em. 2.","1054 Budapest, Honvéd utca 8. 1. em. 2.",
91108,Hírös Modul Szuperinfó Korlátolt Felelősségű Társaság,"6000 Kecskemét, Kőhíd u 12-14.","6000 Kecskemét, Kőhíd u 12-14.","6000 Kecskemét, Kőhíd u 12-14.","6000 Kecskemét, Kőhíd utca 17.","6000 Kecskemét, Kőhíd utca 17.","6000 Kecskemét, Kőhíd utca 17.","6000 Kecskemét, Kőhíd utca 17.","6000 Kecskemét, Kőhíd u 12-14."
90955,"GONG RÁDIÓ Információs, Kereskedelmi és Szolgáltató Korlátolt Felelősségű Társaság","6000 Kecskemét, Petőfi S u 1/b.","6000 Kecskemét, Petőfi S u 1/b.","6000 Kecskemét, Petőfi S u 1/b.","6000 Kecskemét, Petőfi S u 1/b.","6000 Kecskemét, Petőfi S u 1/b.","6000 Kecskemét, Petőfi S u 1/b.","6000 Kecskemét, Petőfi S u 1/b.","6000 Kecskemét, Petőfi S u 1/b."
90043,Absolut Media Szolgáltató és Kereskedelmi Korlátolt Felelősségű Társaság,"1022 Budapest, Alsó Törökvész út 9.","1075 Budapest, Madách Imre (Madách Trade Center) út 13-14. A. ép. 8. ",,,,,,
97112,Palóc Press Korlátolt Felelősségű Társaság,,,"1154 Budapest, Szentmihályi út 32.","1154 Budapest, Szentmihályi út 32.","1184 Budapest, Aranyeső utca 8.","1184 Budapest, Aranyeső utca 8.","1184 Budapest, Aranyeső utca 8.","1184 Budapest, Aranyeső utca 8."
92513,RF-HOBBY Lapkiadó Korlátolt Felelősségű Társaság,"1046 Budapest, Kiss Ernő u. 1-3.","1046 Budapest, Kiss Ernő u. 1-3.","1046 Budapest, Kiss Ernő u. 1-3.","1046 Budapest, Újkisház utca 53.","1046 Budapest, Újkisház utca 53.","1046 Budapest, Újkisház utca 53.","1072 Budapest, Rákóczi út 42.","1072 Budapest, Rákóczi út 42."
91040,Haszon Lapkiadó Korlátolt Felelősségű Társaság,"1036 Budapest, Bécsi út 57-59.","1036 Budapest, Lajos utca 78. 2. em.","1036 Budapest, Lajos utca 78. 2. em.","1036 Budapest, Lajos utca 78. 2. em.","1036 Budapest, Lajos utca 78. 2. em.","1036 Budapest, Lajos utca 78. 2. em.","1036 Budapest, Lajos utca 78. 2. em.","1036 Budapest, Lajos utca 78. 2. em."
92015,MŰSOR-HANG Műsorszolgáltató Zártkörűen Működő Részvénytársaság,"1133 Budapest, Váci út 78/b.","1133 Budapest, Váci út 78/b.","1133 Budapest, Váci út 78/B.","1133 Budapest, Váci út 78/B.","1133 Budapest, Váci út 78/B.","1133 Budapest, Váci út 78/B.","1133 Budapest, Váci út 78/B.","1133 Budapest, Váci út 78/b."
98288,Direct Media Agency Reklám és Kiadó Korlátolt Felelősségű Társaság,,"9023 Győr, Tihanyi Árpád u 10. B. ép. I. em. 15.","9023 Győr, Tihanyi Árpád u 10. B. ép. I. em. 15.","9023 Győr, Tihanyi Árpád u 10. B. ép. I. em. 15.","9023 Győr, Tihanyi Árpád u 10. B. ép. I. em. 15.","9023 Győr, Tihanyi Árpád u 10. B. ép. I. em. 15.","9023 Győr, Tihanyi Árpád u 10. B. ép. I. em. 15.","9023 Győr, Tihanyi Árpád u 10. B. ép. I. em. 15."
99393,Nógrád Hírcentrum Korlátolt Felelősségű Társaság,,,,,"3100 Salgótarján, Kassai sor 4. mfsz 59.","3100 Salgótarján, Kassai sor 4. mfsz 59.","3100 Salgótarján, Erzsébet tér 6. II. em.","3100 Salgótarján, Erzsébet tér 6. II. em."
91679,MKIK Szolgáltató Nonprofit Korlátolt Felelősségű Társaság,"1055 Budapest, Kossuth Lajos tér 6-8.","1055 Budapest, Kossuth Lajos tér 6-8.","1055 Budapest, Kossuth Lajos tér 6-8.","1054 Budapest, Szabadság tér 7.","1054 Budapest, Szabadság tér 7.","1054 Budapest, Szabadság tér 7.","1054 Budapest, Szabadság tér 7.","1054 Budapest, Szabadság tér 7."
91541,LÁNCHÍD RÁDIÓ Műsorszolgáltató Korlátolt Felelősségű Társaság,"1089 Budapest, Üllői út 102.","1089 Budapest, Üllői út 102.","1089 Budapest, Üllői út 102.","1089 Budapest, Üllői út 102.","1089 Budapest, Üllői út 102.","1089 Budapest, Üllői út 102.","1089 Budapest, Üllői út 102.","1089 Budapest, Üllői út 102."
96351,Mátra Centrum Korlátolt Felelősségű Társaság,"3261 Pálosvörösmart, Hagyóka utca 1.","3261 Pálosvörösmart, Hagyóka utca 1.","3261 Pálosvörösmart, Hagyóka utca 1.","3261 Pálosvörösmart, Hagyóka út 1.","3261 Pálosvörösmart, Hagyóka út 1.","3261 Pálosvörösmart, Hagyóka út 1.","3300 Eger, Csákány utca 1.","3300 Eger, Csákány utca 1."
97373,SZUPERINFÓ DÉL-KELET MÉDIA Korlátolt Felelősségű Társaság,"4031 Debrecen, Balmazújvárosi út 11.","4031 Debrecen, Balmazújvárosi út 11.","4031 Debrecen, Balmazújvárosi út 11.","4031 Debrecen, Balmazújvárosi út 11.","4031 Debrecen, Balmazújvárosi út 11.","4031 Debrecen, Balmazújvárosi út 11.","4031 Debrecen, Balmazújvárosi út 11.","4031 Debrecen, Balmazújvárosi út 11."
92333,Piac és Profit Kiadó Korlátolt Felelősségű Társaság,"1134 Budapest, Dózsa György út 144.","1134 Budapest, Dózsa György út 144.","1134 Budapest, Dózsa György út 144.","1152 Budapest, Szentmihályi út 171. III. em. 3.11.","1152 Budapest, Szentmihályi út 171. III. em. 3.11.","1152 Budapest, Szentmihályi út 171. III. em. 3.11.","1152 Budapest, Szentmihályi út 171. III. em. 3.11.","1152 Budapest, Szentmihályi út 171. III. em. 3.11."
91029,Hálózatos Televíziók Zártkörűen Működő Részvénytársaság,"1115 Budapest, Bartók Béla út 152. 1. ép.","1115 Budapest, Bartók Béla út 152. 1. ép.","1115 Budapest, Bartók Béla út 152. 1. ép.","1115 Budapest, Bartók Béla út 152. 1. ép.","1115 Budapest, Bartók Béla út 152. 1. ép.","1115 Budapest, Bartók Béla út 152. 1. ép.","1115 Budapest, Bartók Béla út 152. 1. ép.",
92263,PANNON-SOPRON Regionális TV Műsorgyártó és Szolgáltató Korlátolt Felelősségű Társaság,"9400 Sopron, Liszt F u 1.","9400 Sopron, Liszt F u 1.","9400 Sopron, Liszt F u 1.","9400 Sopron, Liszt F u 1.","9400 Sopron, Liszt F u 1.","9400 Sopron, Liszt F u 1.","9400 Sopron, Liszt F u 1.","9400 Sopron, Liszt F u 1."
95732,Kredit Holding Tömegkommunikációs és Szolgáltató Korlátolt Felelősségű Társaság,"4033 Debrecen, Veres P utca 31.","4033 Debrecen, Veres P utca 31.","4033 Debrecen, Veres P utca 31.","4026 Debrecen, Darabos utca 35.","4026 Debrecen, Darabos utca 35.","4026 Debrecen, Darabos utca 35.","4026 Debrecen, Darabos utca 35.","4026 Debrecen, Darabos utca 35."
93439,Opt Ügynöki Korlátolt Felelősségű Társaság,"1053 Budapest, Szép u. 3. 1. em. 3.","1037 Budapest, Bojtár utca 64-66.","1037 Budapest, Bojtár utca 64-66.","1037 Budapest, Bojtár utca 64-66.","1037 Budapest, Bojtár utca 64-66.","1037 Budapest, Bojtár utca 64-66.",,
92287,Pax Televízió Műsorszolgáltató Zártkörűen Működő Részvénytársaság,"1033 Budapest, Bogdáni út 1.","1033 Budapest, Bogdáni út 1.","1033 Budapest, Bogdáni út 1.","1033 Budapest, Bogdáni út 1.","1033 Budapest, Bogdáni út 1.","1033 Budapest, Bogdáni út 1.","1033 Budapest, Bogdáni út 1.","1033 Budapest, Bogdáni út 1."
