96716,Zuglói Médiaszolgáltató Korlátolt felelősségű társaság,,"1145 Budapest, Pétervárad utca 11.-17.","1144 Budapest, Vezér utca 28. B. ép.","1144 Budapest, Vezér utca 28. B. ép.","1144 Budapest, Vezér utca 28. B. ép.","1144 Budapest, Vezér utca 28. B. ép.","1144 Budapest, Vezér utca 28. B. ép.",
91860,MEDIACONTACT KÖZTERÜLET Reklámügynökség Korlátolt Felelősségű Társaság,"1021 Budapest, Hűvösvölgyi út 54. VI. ép. fsz.","1021 Budapest, Hűvösvölgyi út 54. VI. ép. fsz.","1021 Budapest, Hűvösvölgyi út 54. VI. ép. fsz.","1021 Budapest, Hűvösvölgyi út 54. VI. ép. fsz.","1021 Budapest, Hűvösvölgyi út 54. VI. ép. fsz.","1024 Budapest, Ady Endre utca 19.","1024 Budapest, Ady Endre utca 19.","1024 Budapest, Ady Endre utca 19."
91824,Tiszapart Média Szolgáltató és Tanácsadó Korlátolt Felelősségű Társaság,"6756 Tiszasziget, Fűzfa u 7.","6756 Tiszasziget, Fűzfa u 7.","6725 Szeged, Szent Ferenc utca 8. C. ép. I. em. 6.","1141 Budapest, Komócsy utca 11-13. B. lház. 1. em. 6.","1141 Budapest, Komócsy utca 11-13. B. lház. 1. em. 6.","1093 Budapest, Gönczy Pál utca 2. 1. em. 2.","6725 Szeged, Szent Ferenc utca 8. C. ép. 1. em. 6.","6725 Szeged, Szent Ferenc utca 8. C. ép. 1. em. 6."
93544,Karmapa Korlátolt Felelősségű Társaság,"1188 Budapest, Ametiszt utca 32. A. ép.","1152 Budapest, Szőcs Áron utca 2-4. A. ép. fszt. 001.","1152 Budapest, Szőcs Áron utca 2-4. A. ép. fszt. 001.","1152 Budapest, Szőcs Áron utca 2-4. A. ép. fszt. 001.","1152 Budapest, Szőcs Áron utca 2-4. A. ép. fszt. 001.","1016 Budapest, Bérc utca 1. 9.","1027 Budapest, Kacsa utca 15-23.","1092 Budapest, Ráday utca 9. fszt. 8."
92754,Szentgotthárd Városi Televízió és Kábelüzemeltető Nonprofit Korlátolt Felelősségű Társaság,"9970 Szentgotthárd, Széll K tér 6.","9970 Szentgotthárd, Széll K tér 6.","9970 Szentgotthárd, Széll K tér 6.","9970 Szentgotthárd, Széll K tér 6.","9970 Szentgotthárd, Széll K tér 6.","9970 Szentgotthárd, Széll K tér 6.","9970 Szentgotthárd, Széll K tér 6.","9970 Szentgotthárd, Széll K tér 6."
91401,Klubrádió Szolgáltató Zártkörűen Működő Részvénytársaság,"1037 Budapest, Bokor u 1-3-5.","1037 Budapest, Bokor u 1-3-5.","1037 Budapest, Bokor u 1-3-5.","1037 Budapest, Bokor u 1-3-5.","1037 Budapest, Bokor u 1-3-5.","1037 Budapest, Bokor u 1-3-5.","1037 Budapest, Bokor u 1-3-5.","1037 Budapest, Bokor u 1-3-5."
91738,Magyar Televízió Nonprofit Zártkörűen Működő Részvénytársaság,"1037 Budapest, Kunigunda útja 64.","1037 Budapest, Kunigunda útja 64.","1037 Budapest, Kunigunda útja 64.","1016 Budapest, Naphegy tér 8.","1016 Budapest, Naphegy tér 8.","1016 Budapest, Naphegy tér 8.",,
91719,Magyar Rádió Nonprofit Zártkörűen Működő Részvénytársaság,"1088 Budapest, Bródy S. u. 5-7.","1088 Budapest, Bródy S. u. 5-7.","1016 Budapest, Naphegy tér 8.","1016 Budapest, Naphegy tér 8.","1016 Budapest, Naphegy tér 8.","1016 Budapest, Naphegy tér 8.",,
999999,Egyéb üzemeltető,,,,,,,,
100216,Média Centrum Kommunikációs és Szolgáltató Korlátolt Felelősségű Társaság,,,,,,,,"3525 Miskolc, Széchenyi utca 46. 1. em. 5."
100307,Business Publishing Services Kiadói Korlátolt Felelősségű Társaság,,,,,,,,"1075 Budapest, Madách Imre (Madách Trade Center) út 13-14. A. ép. 8. em."
100180,K4A Lapkiadó Korlátolt Felelősségű Társaság,,,,,,,"1033 Budapest, Polgár utca 8-10.","1033 Budapest, Polgár utca 8-10."
100584,Adboard Korlátolt Felelősségű Társaság,,,,,,,,"1024 Budapest, Lövőház utca 30."
100200,XXI. Század Média Korlátolt Felelősségű Társaság,,,,,,,"1066 Budapest, Jókai utca 6.","1066 Budapest, Jókai utca 6."
100410,TV2 Média Csoport Zártkörűen Működő Részvénytársaság,,,,,,,,"1145 Budapest, Róna utca 174."
99538,Viacom International Hungary Korlátolt Felelősségű Társaság,,,,,,,,"1113 Budapest, Bocskai út 134-146."
16895198,,,,,,,,,
